S. No.,Questions,Type
259," c. Describe the parameters that have the greatest sensitivity to cost (e.g., manufacturing efficiencies,
 material cost, material lifetime, etc.). For each parameter you identify, tell us what the current value is, and
 what value you are assuming for your NOAK commercial-scale TEA. If this includes parameters you
 already identified in 1(c), please repeat them here (if applicable). Broadly, what would need to be true for
 your approach to achieve a cost of $100/tonne?",CET
260,"(Parameter with high impact on cost, Current value (units), Value assumed in NOAK TEA (units),
 Why is it feasible to reach the NOAK value?)",CET
261,d. What aspects of your cost analysis are you least confident in?,CET
262,"e. How do the CDR costs calculated in the TEA spreadsheet compare with your own models? If there are
 large differences, please describe why that might be (e.g., you’re assuming different learning rates,
 different multipliers to get from Bare Erected Cost to Total Overnight Cost, favorable contract terms, etc.)",CET
263," f. What is one thing that doesn’t exist today that would make it easier for you to commercialize your
 technology? (e.g., improved sensing technologies, increased access to X, etc.)",CET
264,Public Engagement,CET
265," In alignment with Frontier’s Safety & Legality criteria, Frontier requires projects to consider and address potential
 social, political, and ecosystem risks associated with their deployments. Projects with effective public
 engagement tend to:
 ● Identify key stakeholders in the area they’ll be deploying
 ● Have mechanisms in place to engage and gather opinions from those stakeholders, take those opinions
 seriously, and develop active partnerships, iterating the project as necessary
 The following questions help us gain an understanding of your public engagement strategy and how your project
 is working to follow best practices for responsible CDR project development. We recognize that, for early
 projects, this work may be quite nascent, but we are looking to understand your early approach.",CET
266," a. Who have you identified as relevant external stakeholders, where are they located, and what process did
 you use to identify them? Please include discussion of the communities potentially engaging in or
 impacted by your project’s deployment.",CET
267," b. If applicable, how have you engaged with these stakeholders and communities? Has this work been
 performed in-house, with external consultants, or with independent advisors? If you do have any reports
 on public engagement that your team has prepared, please provide.",CET
268,"c. If applicable, what have you learned from these engagements? What modifications have you already
 made to your project based on this feedback, if any?",CET
269," d. Going forward, do you have changes to your processes for (a) and (b) planned that you have not yet
 implemented? How do you envision your public engagement strategy at the megaton or gigaton scale?",CET
270,Environmental Justice,CET
271," As a part of Frontier’s Safety & Legality criteria, Frontier seeks projects that proactively integrate environmental
 and social justice considerations into their deployment strategy and decision-making on an ongoing basis.",CET
272," a. What are the potential environmental justice considerations, if any, that you have identified associated
 with your project? Who are the key stakeholders? Consider supply chain impacts, worker compensation
 and safety, plant siting, distribution of impacts, restorative justice/activities, job creation in marginalized
 communities, etc",CET
273," b. How do you intend to address any identified environmental justice concerns and / or take advantage of
 opportunities for positive impact?",CET
274,Legal and Regulatory Compliance,CET
275,"a. What legal opinions, if any, have you received regarding deployment of your solution?",CET
276," b. What permits or other forms of formal permission do you require, if any, to engage in the research or
 deployment of your project? What else might be required in the future as you scale? Please clearly
 differentiate between what you have already obtained, what you are currently in the process of obtaining,
 and what you know you’ll need to obtain in the future but have not yet begun the process to do so.",CET
277," c. Is your solution potentially subject to regulation under any international legal regimes? If yes, please
 specify. Have you engaged with these regimes to date?",CET
278," d. In what areas are you uncertain about the legal or regulatory frameworks you’ll need to comply with? This
 could include anything from local governance to international treaties. For some types of projects, we
 recognize that clear regulatory guidance may not yet exist.",CET
279," e. Do you intend to receive any tax credits during the proposed delivery window for Frontier’s purchase?  If
 so, please explain how you will avoid double counting.",CET
280,Offer to Frontier,CET
281,"This table constitutes your offer to Frontier, and will form the basis of contract discussions if you are selected for
 purchase",CET
282," Proposed CDR over the project lifetime (tonnes) (should be net volume after taking into account the uncertainty 
discount proposed in 4(c))",CET
283, Delivery window (at what point should Frontier consider your contract complete? Should match 1(f)),CET
284,Levelized Price ($/metric tonne CO₂) (This is the price per tonne of your offer to us for the tonnage described above),CET
285," Application Supplement: Surface Mineralization and/or Enhanced Weathering
 (Only fill out this supplement if it applies to you)",CET
286,Source Material and Physical Footprint,CET
287,"1. What source material are you using, and how do you procure it?",CET
288,"2. Describe the ecological impacts of obtaining your source material. Is there an existing industry that
 co-produces the minerals required?",CET
289,"3. Do you process that source mineral in any way (e.g., grinding to increase surface area)? What inputs does
 this processing require (e.g. water, energy)? You should have already included their associated carbon
 intensities in your LCA in Section 3.",CET
290,"4. Please fill out the table below regarding your project’s physical footprint. If you don’t know (e.g. you
 procure your source material from a mining company who doesn’t communicate their physical footprint),
 indicate that in the table below.
(Source, Land area (km2) in 2021, Competing/existing project area use (if applicable))",CET
291,Source material mining,CET
292,Source material processing,CET
293,Deployment,CET
294," 5. How much CDR is feasible globally per year using this approach? Please include a reference to support
 this potential capacity.",CET
295," 6. If you weren’t proceeding with this project, what’s the alternative use(s) of your source material? What
 factors would determine this outcome?",CET
296," Human and Ecosystem Impacts, Toxicity Risk",CET
297,"1. What are the estimated environmental release rates of heavy metals (e.g. Cr, Ni, Pb, Hg)? Dust aerosol
 hazards? P loading to streams? How will this be monitored?",CET
298,"2. If minerals are deployed on croplands, what are the estimated effects on crop yields? Include citations to
 support this claim. How will actual effects be monitored?",CET
299,"3. How will you monitor potential impacts on organisms in your deployment environment? (e.g. health of
 humans working in agricultural contexts, health of intertidal species, etc.)",CET